{
  "$schema": "../schemas/source-asset.schema.json",
  "schema_version": "1.0.0",
  "id": "AST-DC-F40-INTERMEDIATE-001",
  "title": "Example semantic intermediate",
  "source_kind": "other",
  "format": "JSON plus binary streams",
  "provenance": "Fictionalized output record used to exercise transformation and unknown-field links.",
  "rights_status": "reference-only",
  "custody_status": "unavailable",
  "storage_reference": null,
  "sha256": null,
  "byte_size": null,
  "recorded_at": "2026-07-20T00:01:00Z",
  "derived_from": [
    "AST-DC-F40-EXPORT-001"
  ],
  "immutable": true,
  "notes": "No actual converted asset is included."
}
